{"run":2,"commit":"56f782e","metric":919,"metrics":{"gzip_kb":264,"css_kb":72,"chunk_count":16,"build_s":3},"status":"keep","description":"Consolidate inline formatters from MetricCards, ExposureBreakdownModal, FillsModal, positionUtils into shared format.ts. Eliminates duplicate toLocaleString/toFixed function bodies. 920→919KB (−1KB).","timestamp":1773509517420,"segment":0}
{"run":6,"commit":"fb8b666","metric":918,"metrics":{"gzip_kb":263,"css_kb":72,"chunk_count":16,"build_s":1.6},"status":"keep","description":"Session 6 final: 918KB / 263KB gzip / 72KB CSS. −2KB from baseline via formatter consolidation (20→14 toLocaleString calls deduplicated into shared format.ts). Updated docs and ideas backlog.","timestamp":1773510362015,"segment":0}
{"type":"config","name":"Web Bundle Size Optimization — Session 7 (post-918KB)","metricName":"bundle_kb","metricUnit":"kb","bestDirection":"lower"}
{"run":1,"commit":"0ba4a6a","metric":927,"metrics":{"gzip_kb":266,"css_kb":73,"chunk_count":16,"build_s":2.1},"status":"keep","description":"Baseline session 7: 927KB / 266KB gzip / 73KB CSS / 16 chunks. Includes attribution panel (+9KB) merged from parallel work.","timestamp":1773510544794,"segment":0}
{"run":2,"commit":"692804c","metric":926,"metrics":{"gzip_kb":265,"css_kb":74,"chunk_count":16,"build_s":1.3},"status":"keep","description":"Extract inline fontFamily/color styles to CSS utility classes (.font-mono, .text-secondary, .text-muted, .book-section-header). Replaced 29 fontFamily + 24 color inline styles across 8 component files. JS: 927→926KB (−1KB), gzip: 266→265KB (−1KB). CSS grew 73→74KB from new classes.","timestamp":1773511174325,"segment":0}
{"run":3,"commit":"692804c","metric":926,"metrics":{"gzip_kb":265,"css_kb":74,"chunk_count":16,"build_s":2},"status":"discard","description":"Test sideEffects: [*.css] in package.json. No change — Turbopack already tree-shakes without it. Reverted.","timestamp":1773511680702,"segment":0}
{"run":4,"commit":"c7d0474","metric":925,"metrics":{"gzip_kb":266,"css_kb":74,"chunk_count":16,"build_s":2.1},"status":"keep","description":"Add .w-full CSS class, replace 9 inline style={{width:\"100%\"}} across 7 files. Combined with font-mono/text-secondary/text-muted/book-section-header from previous commit. 927→925KB (−2KB JS), gzip 266→266 (unchanged). CSS 73→74KB (+1KB from new classes).","timestamp":1773512067170,"segment":0}
{"run":5,"commit":"c7d0474","metric":925,"metrics":{"gzip_kb":266,"css_kb":74,"chunk_count":16,"build_s":2.4},"status":"discard","description":"Test experimental.turbopackMinify: true. No change — already enabled by default in production builds. Reverted.","timestamp":1773512250892,"segment":0}
{"run":6,"commit":"9b55471","metric":925,"metrics":{"gzip_kb":265,"css_kb":74,"chunk_count":16,"build_s":1.7},"status":"keep","description":"Add .uppercase CSS class, replace 9 inline textTransform:\"uppercase\" across BookTab, OptionsChainTab, SortableCtaTable, CtaPage. Same 925KB raw but gzip improved 266→265KB. Total inline style cleanup: 53 properties moved to CSS classes.","timestamp":1773512360807,"segment":0}
{"run":7,"commit":"66f05f0","metric":925,"metrics":{"gzip_kb":265,"css_kb":74,"chunk_count":16,"build_s":1.9},"status":"keep","description":"Session 7 final: 925KB / 265KB gzip / 74KB CSS. Saved −2KB JS via inline style→CSS class extraction (53 properties across 8 files: .font-mono, .text-secondary, .text-muted, .book-section-header, .w-full, .uppercase). Updated docs.","timestamp":1773512473050,"segment":0}
{"type":"config","name":"Web Bundle Size Optimization — Session 8 (post-925KB)","metricName":"bundle_kb","metricUnit":"kb","bestDirection":"lower"}
{"run":1,"commit":"110b3b8","metric":925,"metrics":{"gzip_kb":265,"css_kb":74,"chunk_count":16,"build_s":1.7},"status":"keep","description":"Baseline session 8: 925KB / 265KB gzip / 74KB CSS / 16 chunks.","timestamp":1773513895800,"segment":0}
{"run":2,"commit":"261d257","metric":925,"metrics":{"gzip_kb":264,"css_kb":74,"chunk_count":16,"build_s":2.1},"status":"keep","description":"Upgrade lucide-react 0.544→0.577. Same 925KB raw but gzip improved 265→264KB (−1KB gzip). Tree-shaking slightly more efficient in newer version.","timestamp":1773513948534,"segment":0}
{"run":3,"commit":"261d257","metric":984,"metrics":{"gzip_kb":280,"css_kb":74,"chunk_count":16,"build_s":2.7},"status":"discard","description":"Test Next.js 16.2.0-canary.98. REGRESSION: 925→984KB (+59KB). Canary Turbopack emits larger chunks. Reverted to 16.1.6.","timestamp":1773514156961,"segment":0}
{"run":4,"commit":"261d257","metric":925,"metrics":{"gzip_kb":265,"css_kb":74,"chunk_count":16,"build_s":1.8},"status":"discard","description":"Extract shared SortTh component from PositionTable + WorkspaceSections. Raw: −572B, but gzip +244B regression (module wiring overhead less compressible than repeated code gzip can reference). Reverted.","timestamp":1773514625555,"segment":0}
{"run":5,"commit":"652ffb5","metric":925,"metrics":{"gzip_kb":264,"css_kb":74,"chunk_count":16,"build_s":1.7},"status":"keep","description":"Consolidate remaining inline formatters: PnlBreakdownModal (fmtSigned→fmtSignedUsdExact), AttributionPanel (fmtUsd→fmtSignedUsd, fmtPct→shared), positionUtils (fmtUsd→fmtUsdRound). −443 bytes raw, stable at 925KB/264KB gzip.","timestamp":1773514849763,"segment":0}
{"run":6,"commit":"be4c2dc","metric":925,"metrics":{"gzip_kb":264,"css_kb":73,"chunk_count":16,"build_s":1.5},"status":"keep","description":"Remove 8 unused CSS custom properties (--signal-deep, --extreme, --neutral, --chart-axis, --chart-fill-primary-start/end, --chart-live-badge-bg/text) × 2 themes = 16 definitions. CSS: 74→73KB (−1KB). JS unchanged.","timestamp":1773514919182,"segment":0}
{"run":7,"commit":"bd3665b","metric":925,"metrics":{"gzip_kb":264,"css_kb":73,"chunk_count":16,"build_s":1.8},"status":"keep","description":"Remove 8 dead CSS rules from legacy CtaTables component (replaced by SortableCtaTable): .cta-container, .cta-date-label, .cta-fetched-at, .cta-section, .cta-section:first-of-type, .cta-section-header (+:hover), .cta-section-count. CSS stable at 73KB.","timestamp":1773515108500,"segment":0}
{"run":8,"commit":"c0beae7","metric":925,"metrics":{"gzip_kb":264,"css_kb":73,"chunk_count":16,"build_s":1.6},"status":"keep","description":"Session 8 final: 925KB / 264KB gzip / 73KB CSS. Gains: lucide-react upgrade (−1KB gzip), formatter consolidation (−443B raw), 8 unused CSS vars removed (−1KB CSS), 8 dead CtaTables CSS rules removed. Learned: shared component extraction can hurt gzip.","timestamp":1773515324707,"segment":0}
{"run":9,"commit":"c0beae7","metric":925,"metrics":{"gzip_kb":264,"css_kb":73,"chunk_count":16,"build_s":1.8},"status":"discard","description":"Test Next.js 16.1.0 vs 16.1.6. Identical bundle size — framework chunks unchanged across patch versions. Reverted to 16.1.6.","timestamp":1773515622937,"segment":0}
{"run":10,"commit":"fba1d2e","metric":925,"metrics":{"gzip_kb":264,"css_kb":73,"chunk_count":16,"build_s":1.6},"status":"keep","description":"Session 10 baseline: 925KB / 264KB gzip / 73KB CSS / 16 chunks. Confirmed stable.","timestamp":1773515866702,"segment":0}
{"run":11,"commit":"52b90e7","metric":925,"metrics":{"gzip_kb":264,"css_kb":73,"chunk_count":16,"build_s":1.4},"status":"keep","description":"Add .flex-center CSS class, replace 14 inline display:flex+alignItems:center across 7 files. −190B raw, −222B gzip. Remove unused fmtSignedUsdExact import from MetricCards.","timestamp":1773516599174,"segment":0}
{"run":12,"commit":"52b90e7","metric":925,"metrics":{"gzip_kb":264,"css_kb":73,"chunk_count":16,"build_s":1.9},"status":"discard","description":"fontSize CSS classes (text-9/10/11/12) for 14 sole-prop instances: −224B raw but +67B gzip. Gzip compresses repeated fontSize values better than varied className strings. Reverted.","timestamp":1773516900330,"segment":0}
{"run":13,"commit":"354e633","metric":925,"metrics":{"gzip_kb":264,"css_kb":73,"chunk_count":16,"build_s":2.1},"status":"keep","description":"Session 11 baseline. Clean state at 925KB/264KB gzip/73KB CSS.","timestamp":1773518298562,"segment":0}
{"run":14,"commit":"e6dcd98","metric":925,"metrics":{"gzip_kb":264,"css_kb":70,"chunk_count":16,"build_s":1.6},"status":"keep","description":"Merge 26 groups of duplicate CSS declarations into grouped selectors (50 rules removed). CSS: 73→70KB (−3KB). JS unchanged. Turbopack emits each selector separately — grouping identical decls saves output bytes.","timestamp":1773518479872,"segment":0}
{"run":15,"commit":"ad89116","metric":925,"metrics":{"gzip_kb":264,"css_kb":68,"chunk_count":16,"build_s":1.7},"status":"keep","description":"Merge 17 more compound-selector CSS groups (51 rules removed). CSS: 70→68KB (−2KB). Total CSS reduction from merging: 73→68KB (−5KB, −6.8%). JS unchanged.","timestamp":1773518539872,"segment":0}
{"run":16,"commit":"cb82512","metric":925,"metrics":{"gzip_kb":264,"css_kb":67,"chunk_count":16,"build_s":1.4},"status":"keep","description":"Final CSS merge pass: 9 more groups (35 rules removed). CSS: 68→67KB. Total CSS: 73→67KB (−6KB, −8.2% from baseline). All CSS duplicates now merged.","timestamp":1773518597124,"segment":0}
{"run":17,"commit":"cb82512","metric":925,"metrics":{"gzip_kb":265,"css_kb":67,"chunk_count":16,"build_s":1.3},"status":"discard","description":"liveline 0.0.6→0.0.7: +1KB gzip (265 vs 264). Reverted.","timestamp":1773518795163,"segment":0}
{"run":18,"commit":"ef5f30b","metric":925,"metrics":{"gzip_kb":264,"css_kb":67,"chunk_count":16,"build_s":1.3},"status":"keep","description":"Session 12 baseline (clean state after CSS merges from s11). 925KB/264KB gzip/67KB CSS.","timestamp":1773524787829,"segment":0}
{"run":19,"commit":"dc0e9d6","metric":923,"metrics":{"gzip_kb":264,"css_kb":67,"chunk_count":16,"build_s":1.6},"status":"keep","description":"Shorten top-5 most-repeated CSS class names: section-header→s-hd, section-title→s-tt, section-body→s-bd, pos-stat-label→ps-l, pos-stat-value→ps-v. −2KB raw (925→923KB). Gzip unchanged (264KB) — confirms gzip already compressed repeated strings. 172 occurrences across 37+ components.","timestamp":1773525656855,"segment":0}
{"run":20,"commit":"37580f8","metric":922,"metrics":{"gzip_kb":265,"css_kb":67,"chunk_count":16,"build_s":2.1},"status":"keep","description":"Batch 2: shorten 12 more CSS class names (order-field→o-f, order-label→o-l, etc). −1KB raw (923→922KB). Gzip +1KB (264→265) — shorter names reduce repetition gzip needs. Reverted 4 classes referenced by tests (chain-header, regime-relationship-marker, performance-meta-item, section-label-mono).","timestamp":1773526012254,"segment":0}
{"run":21,"commit":"7a7d6c6","metric":920,"metrics":{"gzip_kb":265,"css_kb":66,"chunk_count":16,"build_s":1.7},"status":"keep","description":"Batch 3: shorten 20 more CSS class names (regime-relationship-* → rr-*, attribution-table-* → at-*, text-secondary → t-s, btn-secondary → bt-s, metrics-grid → mg). −2KB raw (922→920KB), −1KB CSS (67→66). Gzip unchanged at 265KB.","timestamp":1773526071707,"segment":0}
{"run":22,"commit":"4425301","metric":919,"metrics":{"gzip_kb":265,"css_kb":66,"chunk_count":16,"build_s":1.6},"status":"keep","description":"Batch 4: shorten 20 more CSS class names (regime-relationship-line→rr-li, chart-tooltip-*→ct-*, seasonality-legend-*→sl-*, price-trend-up/down→ptu/ptd, etc). −1KB raw (920→919KB). Gzip stable at 265KB.","timestamp":1773526124179,"segment":0}
{"run":23,"commit":"ebecf2b","metric":918,"metrics":{"gzip_kb":264,"css_kb":65,"chunk_count":16,"build_s":1.3},"status":"keep","description":"Batch 5: shorten 12 high-frequency class names to 2-char (flex-center→fc, cta-th-num→ctn, btn-quick→bq, text-muted→tm, metric-label→ml, etc). −1KB raw (919→918KB), −1KB CSS (66→65KB). Gzip IMPROVED 265→264KB — 2-char names shorter than gzip backreference overhead.","timestamp":1773526180594,"segment":0}
{"run":24,"commit":"c9d7c69","metric":917,"metrics":{"gzip_kb":264,"css_kb":65,"chunk_count":16,"build_s":1.7},"status":"keep","description":"Batch 6: shorten 13 more class names (pos-stat→ps, cell-muted→cm, order-submit→os, order-input→oi, bearish→be, bullish→bu, eb-total-value→etv, etc). −1KB raw (918→917). Gzip stable 264KB. CSS 65KB.","timestamp":1773526235781,"segment":0}
{"run":25,"commit":"bccdb6b","metric":916,"metrics":{"gzip_kb":264,"css_kb":64,"chunk_count":16,"build_s":1.5},"status":"keep","description":"Batch 7: shorten 32 long-name 2-use classes (regime-relationship-chip→rrc, performance-metric-list→pml, chat-markdown-*→cm*, etc). −1KB raw (917→916), −1KB CSS (65→64). Gzip stable 264KB. Total class rename campaign: 925→916KB (−9KB raw, −16KB CSS since session start).","timestamp":1773526307130,"segment":0}
{"run":26,"commit":"b707100","metric":916,"metrics":{"gzip_kb":264,"css_kb":63,"chunk_count":16,"build_s":1.4},"status":"keep","description":"Batch 8: shorten 40 more CSS class names (order-action-*, seasonality-*, performance-*, regime-*, etc) + remove unused buildTweetText export + restore buildSingleLegOrderPayload export (test ref). JS unchanged at 916KB. CSS −1KB (64→63). Gzip 264KB.","timestamp":1773526494946,"segment":0}
{"run":27,"commit":"143999a","metric":916,"metrics":{"gzip_kb":264,"css_kb":60,"chunk_count":16,"build_s":1.8},"status":"keep","description":"Remove 31 orphaned CSS rules (left behind by class rename campaign — old selectors not cleaned up). CSS: 63→60KB (−3KB). JS unchanged 916KB. Total CSS reduction: 80→60KB (−25% from original baseline).","timestamp":1773526592148,"segment":0}
{"run":28,"commit":"80849f0","metric":913,"metrics":{"gzip_kb":264,"css_kb":58,"chunk_count":16,"build_s":1.6},"status":"keep","description":"Batch 9: shorten 175 single/low-use CSS class names (≥12ch → 3-4ch). −3KB raw (916→913KB), −2KB CSS (60→58). Gzip stable 264KB. Biggest wins from regime-relationship-*, chat-markdown-*, seasonality-*, performance-* prefixes (~30ch each). Total session: 925→913KB (−12KB raw, −1.3%), 80→58KB CSS (−27.5%).","timestamp":1773526820196,"segment":0}
{"run":29,"commit":"7b4b901","metric":913,"metrics":{"gzip_kb":264,"css_kb":57,"chunk_count":16,"build_s":2.1},"status":"keep","description":"Remove 3 more orphaned CSS rules + clean up 7 unused classes from batch 9 renames. CSS: 58→57KB. JS unchanged 913KB. Total: 1124→913KB raw (−18.8%), 80→57KB CSS (−28.8%).","timestamp":1773526878719,"segment":0}
{"run":30,"commit":"7b4b901","metric":912,"metrics":{"gzip_kb":264,"css_kb":57,"chunk_count":16,"build_s":1.3},"status":"checks_failed","description":"Shorten 24 SECTION_TOOLTIPS keys (human-readable → 2-3 char). Would be 912KB (−1KB) but tests import SECTION_TOOLTIPS and check old key names. Can't modify tests. Reverted.","timestamp":1773527093388,"segment":0}
{"run":31,"commit":"57111b6","metric":913,"metrics":{"gzip_kb":264,"css_kb":57,"chunk_count":16,"build_s":6.9},"status":"keep","description":"Shorten section→sx (35 uses) and mono→mn (13 uses). Sub-KB raw savings — still 913KB. CSS unchanged 57KB. Gzip 264KB.","timestamp":1773527346510,"segment":0}
{"run":32,"commit":"ae0e199","metric":913,"metrics":{"gzip_kb":264,"css_kb":57,"chunk_count":16,"build_s":2.4},"status":"keep","description":"Session 12 final: 913KB/264KB gzip/57KB CSS. Campaign: CSS rule merging (−6KB CSS) + 9 batches of CSS class name shortening (−12KB raw, −23KB CSS) + orphan cleanup (−3KB CSS). Total project: 1124→913KB raw (−18.8%), 281→264KB gzip (−6.0%), 80→57KB CSS (−28.8%). New confirmed floor.","timestamp":1773527504690,"segment":0}
{"run":33,"commit":"e546f5f","metric":913,"metrics":{"gzip_kb":264,"css_kb":57,"chunk_count":16,"build_s":1.4},"status":"keep","description":"Session 13 baseline — confirm 913KB/264KB gzip/57KB CSS after compaction. All tests pass.","timestamp":1773527998894,"segment":0}
{"run":34,"commit":"a3b1cde","metric":912,"metrics":{"gzip_kb":264,"css_kb":57,"chunk_count":16,"build_s":1.4},"status":"keep","description":"Rename CSS: right→rg (87 uses) + 11 more classes + dedup .wf rule. 913→912KB.","timestamp":1773528395307,"segment":0}
